{
  "$schema": "../schema.json",
  "topic": "Notion",
  "slug": "notion",
  "description": "Tools, SDKs and integrations for the Notion ecosystem",
  "cover": "🗂️",
  "tasks": [
    {
      "task": "Query the API",
      "entries": [
        { "name": "notion-sdk-js", "language": "TypeScript", "specialty": "Official Notion JavaScript/TypeScript client for the REST API", "docs": "https://github.com/makenotion/notion-sdk-js", "note": "", "flags": [] },
        { "name": "notion-sdk-py", "language": "Python", "specialty": "Community Python client that closely tracks the official REST API", "docs": "https://github.com/ramnes/notion-sdk-py", "note": "", "flags": [] },
        { "name": "notionapi", "language": "Go", "specialty": "Actively maintained Go client for the Notion API (jomei/notionapi)", "docs": "https://github.com/jomei/notionapi", "note": "", "flags": [] },
        { "name": "notion-client", "language": "Rust", "specialty": "Async Rust client crate for the Notion API", "docs": "https://github.com/takassh/notion-client", "note": "", "flags": [] },
        { "name": "Postman", "language": "Any", "specialty": "GUI REST client for exploring and scripting Notion API requests", "docs": "https://www.postman.com", "note": "Free tier is generous; team collaboration features are paid.", "flags": ["paid"] },
        { "name": "Insomnia", "language": "Any", "specialty": "Open-core REST/GraphQL client popular for testing Notion API calls", "docs": "https://insomnia.rest", "note": "Core client is free; team sync/collaboration is paid.", "flags": ["paid"] },
        { "name": "HTTPie", "language": "Any", "specialty": "Friendly CLI HTTP client for quick, readable Notion API requests", "docs": "https://httpie.io", "note": "CLI is free/open source; hosted desktop app has paid plans.", "flags": ["paid"] },
        { "name": "curl", "language": "Any", "specialty": "Universal command-line tool for calling the Notion REST API directly", "docs": "https://curl.se", "note": "", "flags": [] }
      ]
    },
    {
      "task": "Build integrations",
      "entries": [
        { "name": "Vercel", "language": "Any", "specialty": "Serverless hosting commonly used to deploy Notion integration backends", "docs": "https://vercel.com", "note": "Generous free tier; usage-based paid tiers beyond it.", "flags": ["paid"] },
        { "name": "Netlify Functions", "language": "Any", "specialty": "Serverless functions platform used to host Notion webhook/integration endpoints", "docs": "https://www.netlify.com/products/functions/", "note": "", "flags": ["paid"] },
        { "name": "Cloudflare Workers", "language": "Any", "specialty": "Edge compute platform for lightweight Notion integration endpoints", "docs": "https://developers.cloudflare.com/workers/", "note": "", "flags": ["paid"] },
        { "name": "Express", "language": "JavaScript", "specialty": "Minimal Node.js web framework for building Notion integration servers", "docs": "https://expressjs.com", "note": "", "flags": [] },
        { "name": "FastAPI", "language": "Python", "specialty": "Modern async Python web framework for building Notion integration APIs", "docs": "https://fastapi.tiangolo.com", "note": "", "flags": [] },
        { "name": "Fiber", "language": "Go", "specialty": "Fast, Express-inspired Go web framework for Notion integration backends", "docs": "https://gofiber.io", "note": "", "flags": [] },
        { "name": "ngrok", "language": "Any", "specialty": "Tunnels a local dev server so Notion webhooks can reach it during development", "docs": "https://ngrok.com", "note": "Free tier has one tunnel and random URLs; custom domains are paid.", "flags": ["paid"] },
        { "name": "Zapier Platform CLI", "language": "JavaScript", "specialty": "Build and publish custom Zapier integrations that wrap the Notion API", "docs": "https://docs.zapier.com/integrations/build-cli/overview", "note": "", "flags": [] }
      ]
    },
    {
      "task": "Authenticate users",
      "entries": [
        { "name": "simple-oauth2", "language": "JavaScript", "specialty": "Generic OAuth2 client library usable for Notion's OAuth authorization flow", "docs": "https://github.com/lelylan/simple-oauth2", "note": "", "flags": [] },
        { "name": "Authlib", "language": "Python", "specialty": "Python OAuth2/OpenID library usable for Notion integration login flows", "docs": "https://authlib.org", "note": "", "flags": [] },
        { "name": "golang.org/x/oauth2", "language": "Go", "specialty": "Go's standard OAuth2 client package, usable for Notion's OAuth flow", "docs": "https://pkg.go.dev/golang.org/x/oauth2", "note": "", "flags": [] },
        { "name": "oauth2-rs", "language": "Rust", "specialty": "Rust OAuth2 client crate implementing the authorization code flow", "docs": "https://github.com/ramosbugs/oauth2-rs", "note": "", "flags": [] },
        { "name": "Auth.js", "language": "TypeScript", "specialty": "Auth framework (formerly NextAuth.js) configurable with a generic OAuth provider for Notion login", "docs": "https://authjs.dev", "note": "", "flags": [] },
        { "name": "Passport.js", "language": "JavaScript", "specialty": "Node.js auth middleware with an OAuth2 strategy usable for Notion sign-in", "docs": "https://www.passportjs.org", "note": "", "flags": [] },
        { "name": "Auth0", "language": "Any", "specialty": "Hosted identity platform that can front a custom Notion OAuth connection", "docs": "https://auth0.com", "note": "Free tier capped by monthly active users.", "flags": ["paid"] },
        { "name": "mkcert", "language": "Any", "specialty": "Generates trusted local HTTPS certificates needed to test Notion OAuth redirect URIs locally", "docs": "https://github.com/FiloSottile/mkcert", "note": "", "flags": [] }
      ]
    },
    {
      "task": "Sync databases",
      "entries": [
        { "name": "n8n", "language": "Any", "specialty": "Workflow automation platform with a native Notion node for two-way database syncs", "docs": "https://n8n.io", "note": "Self-hosted is free (fair-code licence); cloud plans are paid.", "flags": ["paid"] },
        { "name": "Zapier", "language": "Any", "specialty": "No-code automation platform with Notion triggers/actions for syncing databases", "docs": "https://zapier.com", "note": "Free tier capped on monthly tasks.", "flags": ["paid"] },
        { "name": "Make", "language": "Any", "specialty": "Visual scenario builder with deep two-way Notion database sync modules", "docs": "https://www.make.com", "note": "Free tier capped on monthly operations.", "flags": ["paid"] },
        { "name": "Airbyte", "language": "Any", "specialty": "Open-source data integration platform with a Notion source connector", "docs": "https://airbyte.com", "note": "Self-hosted OSS is free; Cloud is paid.", "flags": ["paid"] },
        { "name": "Pipedream", "language": "Any", "specialty": "Serverless integration platform with prebuilt Notion database sync workflows", "docs": "https://pipedream.com", "note": "Free tier capped on monthly invocations.", "flags": ["paid"] },
        { "name": "Fivetran", "language": "Any", "specialty": "Managed data pipeline connector for syncing Notion databases into a warehouse", "docs": "https://www.fivetran.com", "note": "", "flags": ["paid"] },
        { "name": "Whalesync", "language": "Any", "specialty": "Real-time two-way sync tool built specifically for Notion databases", "docs": "https://www.whalesync.com", "note": "", "flags": ["paid"] },
        { "name": "Coefficient", "language": "Any", "specialty": "Syncs Notion databases with Google Sheets and Excel in real time", "docs": "https://coefficient.io", "note": "", "flags": ["paid"] }
      ]
    },
    {
      "task": "Automate workflows",
      "entries": [
        { "name": "Notion Automations", "language": "Any", "specialty": "Native database automations: trigger a button or event, then run actions inside Notion", "docs": "https://www.notion.com/help/database-automations", "note": "Basic automations are on all plans; advanced triggers need a paid plan.", "flags": ["paid"] },
        { "name": "IFTTT", "language": "Any", "specialty": "Simple trigger-action automation platform with a Notion service", "docs": "https://ifttt.com", "note": "Free tier capped at 2 applets.", "flags": ["paid"] },
        { "name": "Workato", "language": "Any", "specialty": "Enterprise-grade integration and automation platform with Notion connectors", "docs": "https://www.workato.com", "note": "", "flags": ["paid"] },
        { "name": "Tray.io", "language": "Any", "specialty": "Low-code automation platform for building Notion-connected workflows", "docs": "https://tray.ai", "note": "", "flags": ["paid"] },
        { "name": "Google Apps Script", "language": "JavaScript", "specialty": "Serverless JS runtime for scripting scheduled Notion API automations from Sheets/Docs", "docs": "https://developers.google.com/apps-script", "note": "", "flags": [] },
        { "name": "GitHub Actions", "language": "Any", "specialty": "CI/CD runner commonly used to schedule and run Notion automation scripts", "docs": "https://github.com/features/actions", "note": "Free minutes are capped per month for private repos.", "flags": ["paid"] },
        { "name": "node-cron", "language": "JavaScript", "specialty": "Lightweight Node.js task scheduler for running custom Notion automation scripts", "docs": "https://github.com/node-cron/node-cron", "note": "", "flags": [] },
        { "name": "APScheduler", "language": "Python", "specialty": "Python task scheduling library for running periodic Notion automation scripts", "docs": "https://apscheduler.readthedocs.io", "note": "", "flags": [] }
      ]
    },
    {
      "task": "Publish as a website",
      "entries": [
        { "name": "Super", "language": "Any", "specialty": "Turns a Notion page into a fully custom website with your own domain", "docs": "https://super.so", "note": "", "flags": ["paid"] },